{
  "case_id": "CASE-BLUESKY-001",
  "btr_id": "BTR-BLUESKY-001",
  "state": "under_review",
  "redacted_summary": "Request to correct a non-sensitive public metadata field while evidence remains limited.",
  "evidence_pack_refs": [
    "HASH-BLUESKY-001"
  ],
  "opened_at": "2026-04-06T16:00:00Z",
  "updated_at": "2026-04-07T18:00:00Z"
}
